{
  "$schema": "https://json-schema.org/draft/2020-12/schema",
  "$id": "https://spec.modulora.dev/schemas/v0/modulora-item.schema.json",
  "title": "Modulora Companion Item Manifest v0",
  "description": "Ownership, provenance, source-model, and commerce metadata that accompanies a shadcn-compatible registry item. This document references the canonical shadcn item; it never duplicates it.",
  "type": "object",
  "additionalProperties": false,
  "required": [
    "schemaVersion",
    "namespace",
    "name",
    "version",
    "framework",
    "sourceModel",
    "visibility",
    "owner",
    "shadcnItem",
    "license"
  ],
  "properties": {
    "schemaVersion": {
      "const": "0"
    },
    "namespace": {
      "type": "string",
      "minLength": 2,
      "maxLength": 40,
      "pattern": "^[a-z0-9](?:[a-z0-9-]{0,38}[a-z0-9])?$",
      "description": "Owner-scoped namespace. Lowercase alphanumerics and single hyphens."
    },
    "name": {
      "type": "string",
      "minLength": 2,
      "maxLength": 64,
      "pattern": "^[a-z0-9](?:[a-z0-9-]{0,62}[a-z0-9])?$"
    },
    "version": {
      "type": "string",
      "maxLength": 64,
      "pattern": "^(0|[1-9]\\d*)\\.(0|[1-9]\\d*)\\.(0|[1-9]\\d*)(?:-[0-9A-Za-z.-]{1,32})?$",
      "description": "Immutable release version (SemVer, no build metadata)."
    },
    "framework": {
      "type": "string",
      "enum": [
        "react"
      ],
      "description": "Launch supports React only. Vue and Svelte are future additive values."
    },
    "sourceModel": {
      "type": "string",
      "enum": [
        "open-source",
        "external-commercial",
        "private-team",
        "hosted-commercial"
      ]
    },
    "visibility": {
      "type": "string",
      "enum": [
        "public",
        "unlisted",
        "private"
      ]
    },
    "owner": {
      "type": "object",
      "additionalProperties": false,
      "required": [
        "kind",
        "identifier"
      ],
      "properties": {
        "kind": {
          "type": "string",
          "enum": [
            "user",
            "organization"
          ]
        },
        "identifier": {
          "type": "string",
          "minLength": 1,
          "maxLength": 100,
          "pattern": "^[A-Za-z0-9](?:[A-Za-z0-9-]{0,98}[A-Za-z0-9])?$"
        }
      }
    },
    "source": {
      "type": "object",
      "additionalProperties": false,
      "required": [
        "repository",
        "commit"
      ],
      "properties": {
        "repository": {
          "type": "string",
          "maxLength": 300,
          "pattern": "^https://[a-z0-9.-]+/[A-Za-z0-9._/-]+$"
        },
        "commit": {
          "type": "string",
          "pattern": "^[a-f0-9]{40}$"
        }
      },
      "description": "Canonical source reference. Required for open-source and private-team items."
    },
    "shadcnItem": {
      "type": "object",
      "additionalProperties": false,
      "required": [
        "schema",
        "name",
        "type",
        "url",
        "contentCanonicalization",
        "contentSha256"
      ],
      "properties": {
        "schema": {
          "const": "https://ui.shadcn.com/schema/registry-item.json",
          "description": "Upstream shadcn registry-item schema targeted by the hosted install document."
        },
        "name": {
          "type": "string",
          "minLength": 2,
          "maxLength": 64,
          "pattern": "^[a-z0-9](?:[a-z0-9-]{0,62}[a-z0-9])?$",
          "description": "MUST equal the companion manifest name and the fetched registry-item name."
        },
        "type": {
          "type": "string",
          "enum": [
            "registry:lib",
            "registry:block",
            "registry:component",
            "registry:ui",
            "registry:hook",
            "registry:theme",
            "registry:page",
            "registry:file",
            "registry:style",
            "registry:base",
            "registry:font",
            "registry:item"
          ],
          "description": "MUST equal the fetched registry-item type. Components and blocks remain distinct from taxonomy category/componentType."
        },
        "url": {
          "type": "string",
          "maxLength": 500,
          "pattern": "^https://[a-z0-9.-]+/\\S+$"
        },
        "contentCanonicalization": {
          "const": "modulora-content-v0",
          "description": "LF-normalized file contents; sorted by path using codepoint order; each pair encoded as <pathLength>:<path>\\n<contentLength>:<content>; pairs joined by LF-NUL-LF."
        },
        "contentSha256": {
          "type": "string",
          "pattern": "^[a-f0-9]{64}$",
          "description": "SHA-256 of the exact install files using modulora-content-v0. This is the same value served as registry-item meta.contentSha256; meta itself is excluded to avoid self-reference."
        }
      },
      "description": "Reference and semantic mapping to the canonical hosted shadcn registry-item. The companion never duplicates dependencies, files, CSS, env vars, docs, or other install payload fields."
    },
    "license": {
      "type": "object",
      "additionalProperties": false,
      "required": [
        "kind"
      ],
      "properties": {
        "kind": {
          "type": "string",
          "enum": [
            "spdx",
            "commercial",
            "custom"
          ]
        },
        "spdxExpression": {
          "type": "string",
          "minLength": 1,
          "maxLength": 200
        },
        "url": {
          "type": "string",
          "maxLength": 500,
          "pattern": "^https://\\S+$"
        }
      },
      "allOf": [
        {
          "if": {
            "properties": {
              "kind": {
                "const": "spdx"
              }
            }
          },
          "then": {
            "required": [
              "spdxExpression"
            ]
          }
        }
      ]
    },
    "purchase": {
      "type": "object",
      "additionalProperties": false,
      "required": [
        "url",
        "domain"
      ],
      "properties": {
        "url": {
          "type": "string",
          "maxLength": 500,
          "pattern": "^https://\\S+$"
        },
        "domain": {
          "type": "string",
          "maxLength": 253,
          "pattern": "^(?!-)[a-z0-9-]{1,63}(?<!-)(\\.(?!-)[a-z0-9-]{1,63}(?<!-))+$"
        },
        "priceLabel": {
          "type": "string",
          "maxLength": 60
        }
      },
      "description": "Creator-controlled purchase destination. Required for external-commercial items. priceLabel is creator-provided and unverified."
    },
    "support": {
      "type": "object",
      "additionalProperties": false,
      "properties": {
        "url": {
          "type": "string",
          "maxLength": 500,
          "pattern": "^https://\\S+$"
        },
        "status": {
          "type": "string",
          "enum": [
            "active",
            "maintenance",
            "deprecated"
          ]
        }
      }
    },
    "deprecation": {
      "type": "object",
      "additionalProperties": false,
      "required": [
        "reason"
      ],
      "properties": {
        "reason": {
          "type": "string",
          "minLength": 1,
          "maxLength": 500
        },
        "replacement": {
          "type": "string",
          "maxLength": 200
        }
      }
    },
    "category": {
      "type": "string",
      "minLength": 2,
      "maxLength": 40,
      "pattern": "^[a-z0-9](?:[a-z0-9-]*[a-z0-9])?$",
      "description": "Canonical category ID from taxonomy/v0/taxonomy.json (aliases resolved first). Required by registries at publish time; optional in the manifest for backward compatibility with v0 artifacts."
    },
    "componentType": {
      "type": "string",
      "minLength": 2,
      "maxLength": 40,
      "pattern": "^[a-z0-9](?:[a-z0-9-]*[a-z0-9])?$",
      "description": "Optional canonical component type from taxonomy/v0/taxonomy.json \u2014 what the thing is (button, dialog), orthogonal to category (what it's for)."
    },
    "tags": {
      "type": "array",
      "maxItems": 10,
      "uniqueItems": true,
      "items": {
        "type": "string",
        "minLength": 2,
        "maxLength": 30,
        "pattern": "^[a-z0-9](?:[a-z0-9-]*[a-z0-9])?$"
      },
      "description": "Creator-defined discovery tags, normalized lowercase-kebab. Subject to moderation; never part of the source digest."
    }
  },
  "allOf": [
    {
      "if": {
        "properties": {
          "sourceModel": {
            "const": "external-commercial"
          }
        }
      },
      "then": {
        "required": [
          "purchase"
        ]
      }
    },
    {
      "if": {
        "properties": {
          "sourceModel": {
            "enum": [
              "open-source",
              "private-team"
            ]
          }
        }
      },
      "then": {
        "required": [
          "source"
        ]
      }
    },
    {
      "if": {
        "properties": {
          "sourceModel": {
            "const": "open-source"
          }
        }
      },
      "then": {
        "properties": {
          "license": {
            "properties": {
              "kind": {
                "const": "spdx"
              }
            }
          }
        }
      }
    }
  ]
}