{
  "schemaVersion": "0",
  "namespace": "northstar",
  "name": "calendar",
  "version": "1.2.0",
  "framework": "react",
  "sourceModel": "open-source",
  "visibility": "public",
  "owner": {
    "kind": "organization",
    "identifier": "northstar-ui"
  },
  "source": {
    "repository": "https://github.com/northstar-ui/components",
    "commit": "bbbbbbbbbbbbbbbbbbbbbbbbbbbbbbbbbbbbbbbb"
  },
  "shadcnItem": {
    "schema": "https://ui.shadcn.com/schema/registry-item.json",
    "name": "calendar",
    "type": "registry:component",
    "url": "http://evil.example/item.json",
    "contentCanonicalization": "modulora-content-v0",
    "contentSha256": "aaaaaaaaaaaaaaaaaaaaaaaaaaaaaaaaaaaaaaaaaaaaaaaaaaaaaaaaaaaaaaaa"
  },
  "license": {
    "kind": "spdx",
    "spdxExpression": "MIT"
  }
}